isbn,judul,pengarang,id_penerbit,cover,sinopsis,tagline,konten,tahun_terbit
9786238668410,Asha & Her Love,D. A. Lestari,8,asha-and-her-love.png,"Menceritakan tentang Asha, gadis manis yang sedikit pemalu. Karena suatu kejadian, ia menjadi dekat dan berpacaran dengan Dean, kakak kelasnya yang tampan dan populer. Hubungan keduanya pun berjalan harmonis. Sampai suatu hari, tiba-tiba Dean menghilang dan tidak ada kabar selama berbulan-bulan.

Begitu kembali, sikap Dean berubah drastis. Hubungan mereka pun harus berakhir karena alasan Dean yang tidak masuk akal dan pengkhianatannya. Hati Asha hancur berkeping-keping. Bahkan, ia sampai trauma untuk kembali menjalin hubungan. Namun, sesosok lelaki berhasil mengetuk pintu hatinya, membuatnya ragu.

Mampukah Asha melupakan Dean dan memulai lembaran hidupnya dengan laki-laki lain? Lalu, apa alasan Dean meninggalkan Asha dan mengkhianatinya?","“Pertahankan yang mau mempertahankan. Jika tidak, lepaskan! You deserve to be loved.”",,2025
9786233469319,Filosofi Teras,Henry Manampiring,9,filosofi-teras.png,"Lebih dari 2000 tahun lalu, sebuah mazhab filsafat menemukan akar masalah dan juga solusi dari banyak emosi negatif. Stoisisme, atau Filosofi Teras, adalah filsafat Yunani-Romawi kuno yang bisa membantu kita mengatasi emosi negatif dan menghasilkan mental yang tangguh dalam menghadapi naik-turun nya kehidupan.

Jauh dari kesan filsafat sebagai topik berat dan mengawang-awang, Filosofi Teras justru bersifat praktis dan relevan dengan kehidupan Generasi Milenial dan Gen-Z masa kini.

Buku yang pertama kali diterbitkan pada 2019 ini mengajarkan kita tentang pengendalian emosi negatif yang ada dalam diri kita. Buku Filosofi Teras menjadi buku mega best seller, dan memenangkan Book of the Year di Indonesia International Book Fair pada 2019. Filosofi Teras memiliki tebal sebanyak 344 halaman.","Jauh dari kesan filsafat sebagai topik berat dan mengawang-awang, Filosofi Teras justru bersifat praktis dan relevan dengan kehidupan Generasi Milenial dan Gen-Z masa kini.",,2023
9786020531328,Seporsi Mie Ayam Sebelum Mati,brian Khrisna,7,seporsi-mie-ayam-sebelum-mati.png,"Ale, seorang pria berusia 37 tahun memiliki tinggi badan 189 cm dan berat 138 kg. Badannya bongsor, berkulit hitam, dan memiliki masalah dengan bau badan. Sejak kecil, Ale hidup di lingkungan keluarga yang tidak mendukungnya. Ia tak memiliki teman dekat dan menjadi korban perundungan di sekolahnya.
Ale didiagnosis psikiaternya mengalami depresi akut. Bukannya Ale tidak peduli untuk memperbaiki dirinya sendiri, ia peduli. Ale telah berusaha mengatasi masalah-masalah yang timbul dari dirinya agar ia diterima di lingkungan pertemanan. Namun usahanya tidak pernah berhasil. Bahkan keluarganya pun tidak mendukungnya saat Ale membutuhkan sandaran dan dukungan.
Ale siap menenggak seluruh obat antidepresan yang ia punya. Saat ia memain-mainkan botolnya, Ale terdiam saat membaca anjuran di kemasan botol itu, dikonsumsi sesudah makan. Seketika perutnya berbunyi. Dan Ale pun memutuskan untuk makan dulu sebelum mengakhiri hidupnya. Setidaknya, itu akan menjadi satu-satunya keputusan yang bisa dia ambil atas kehendaknya sendiri. Setelah selama hidupnya ia tak pernah mampu melakukan hal-hal yang ia inginkan.

Ale akan makan seporsi mie ayam sebelum mati.","Saat 24 jam itu tiba, Ale telah bersiap dengan kemeja hitam dan celana hitam, bak baju melayat ke pemakamannya sendiri.",,2025
9786231864659,Tiga Belas Jiwa,Salspisang,10,tiga-belas-jiwa.png,"Bagi Manjiw Squad, rumah sakit jiwa tempat mereka bekerja bagaikan rumah kedua. Di RS], mereka bertemu dengan satu lusin manusia lainnya yang bersedia meluangkan diri untuk saling membantu dalam setiap kesulitan dan merayakan setiap pencapaian.

Di tengah hiruk-pikuk pasien dan permasalahan hidup yang nggak ada habisnya, Manjiw Squad menemukan makna keluarga, persahabatan, kehidupan, bahkan tujuan-tujuan dasar alasan mereka terlahir ke dunia.",Apa yang kamu pikirkan ketika mendengar rumah sakit jiwa?,,2025
9786233468909,Membangun Peradaban Dunia,"Untung Widyanto, dkk.",9,membangun-peradaban-dunia.png,"Taman Ismail Marzuki yang dibangun tahun 1968 diniatkan sebagai pusat kesenian yang bebas dari intervensi kekuasaan. Para seniman tidak ingin diatur-atur oleh partai dan penguasa politik seperti yang terjadi di era Demokrasi Terpimpin. Periode Gubernur Ali Sadikin, TIM benar-benar menjadi ekosistem kesenian yang menggairahkan seniman dengan karya-karyanya yang fenomenal.

Bang Ali kemudian dicopot Presiden Soeharto pada 1977, yang diikuti dengan campur tangan birokrat. Setelah itu TIM mengalami kemunduran, seiring dengan munculnya gedung-gedung kesenian di Jakarta. Berbagai upaya dilakukan para Gubernur Jakarta untuk membangkitkan TIM. Gubernur Fauzi Bowo menggelar Sayembara Revitalisasi TIM pada 2007 yang dimenangkan arsitek Andra Matin dengan tema ""Rayuan Pulau Kelapa"".","Buku ini menceritakan dinamika pembangunan TIM yang terjadi di panggung depan dan belakang, sejarah pengelolaan TIM selama setengah abad, serta model pengelolaan TIM ke depan.",,2023
9786025792403,Madilog Tan Malaka: Materialisme Dialektika & Logika,Tim Narasi,11,madilog-tan-malaka.png,"Tan Malaka melihat kemajuan umat manusia harus melalui tiga tahap: Dari ""logika mistika"" lewat ""filsafat"" ke ""ilmu pengetahuan"" (sains). Dan selama bangsa Indonesia masih terkungkung oleh ""logika mistika"" itu, tak mungkin ia menjadi bangsa yang merdeka dan maju. Madilog merupakan jalan keluar dari ""logika mistika"" dan imbauan seorang nasionalis sejati buat bangsanya untuk keluar dari keterbelakangan dan ketertinggalan.","Dan selama bangsa Indonesia masih terkungkung oleh ""logika mistika"" itu, tak mungkin ia menjadi bangsa yang merdeka dan maju.",,2014
9786020680859,Gratis Ongkir: Kelindan Dan Sengkarut Bahasa,Darmawati Majid,1,gratis-ongkir-kelindan-dan-sengkarut-bahasa.png,"Bahasa Indonesia itu rumit, lebih rumit daripada hubungan tanpa kejelasan. Namun, bahasa yang ""katanya"" rumit ini justru mempertemukan penuturnya dengan kekayaan kosakata yang luar biasa. Akan tetapi, bahasa Indonesia belum menjadi identitas yang dapat dibanggakan dalam berbagai praktik bahasa. Perkara ini dapat dikaji lewat satu pertanyaan besar: untuk keperluan apa bahasa itu digunakan? Buku ini menjadi jawabannya.","Seyogianya, esai-esai bahasa dalam buku ini tidak bermaksud menggurui, tetapi untuk memantik diskusi. Semoga buku ini dapat menjadi bacaan yang menyenangkan, yang melengkapi pengetahuan kebahasaan pembacanya.",,2025
9786020683034,Pagar Rumahku Berubah Warna,Ama Gaspar,1,pagar-rumahku-berubah-warna.png,"Dari jendela bergorden tipis, kaki-kaki hujan sesekali menyentuh kaca bening, di mana aku berdiri di sebaliknya. Telah pergi kemarau berumur panjang itu. Akan tiba mekar bunga-bunga di kamar tidur itu. Mulailah menghitung domba-domba, satu untuk setiap harapanmu. Lalu bunga-bunga yang namanya tidak kukenal bermunculan di ruang tamu, dapur, meja makan, dan tempat tidur. Seribu kupu-kupu menjadikan rumahku taman bermain. Kau mungkin akan mengingat ini, dongeng sebelum tidur yang tak punya judul. Aku pun akan mengingat ini sebagai kalimat penghiburan yang tak berupaya menjadi puisi.",Pohon-pohon akasia yang meneduhkan jalanan juga pagar rumahku berubah warna. Warnanya serupa sore kesukaanmu. Sedikit jingga dan banyak merah.,,2025
592302176,Namaku Alam,Leila S. Chudori,2,namaku-alam.jpg,"Inilah yang kubayangkan detik-detik terakhir Bapak: 18 Mei 1970. Hari gelap. Langit berwarna hitam dengan garis ungu. Bulan bersembunyi di balik ranting pohon randu. Sekumpulan burung nasar bertengger di pagar kawat. Mereka mencium aroma manusia yang nyaris jadi mayat bercampur bau mesiu. Terdengar lolongan anjing berkepanjangan. Empat orang berbaris rapi, masing-masing berdiri dengan senapan yang diarahkan kepada Bapak. Hanya satu senapan berisi peluru mematikan. Selebihnya, peluru karet. Tak satu pun di antara keempat lelaki itu tahu siapa yang kelak menghentikan hidup Bapak.",Alam ingat pertama kali dia ditodong senapan oleh seorang lelaki dewasa ketika masih berusia tiga tahun; pertama kali sepupunya mencercanya sebagai anak ‘pengkhianat negara’; ,,2023